id,title,country,body,leaders,banner,code,color,member,tw_link,fb_link,li_link,web_link,lat,lon
58,Budapest,HU,"Budapest is a great city that perfectly incorporates old and modern. The city has become widely popular as a travel destination in the last few years, and therefore, the tourism industry has also recently taken a big step forward.",101,Budapest.jpg,BUD,#4D5383,44|45|46,,https://www.facebook.com/groups/TravelMassiveBudapest/,,,47.4925,19.0514
59,Newcastle,UK,"Set on the banks of the River Tyne, Newcastle is home to some of the most friendly people in the UK, the Geordies. With world class culture, architecture, nightlife and heritage, this is the perfect place for travellers, writers, brands and startups to meet. Join us for creativity, fun and brilliant banter in North East England. ",102,Newcastle.jpg,NEW,#1616DD,47|48|49|50|51|52,,,,,54.9667,-1.6
60,Miami,US,"In 2013, Florida attracted more than 95 million visitors from 189 different countries and continues to solidify its position as a global tourism hub. TravelMassive Miami/South Florida will bring together the travel and hospitality professionals in the region to connect and learn about each otherÕs industries, while enjoying the vibrant nightlife this city is known for. ",103,Miami.jpg,MIA,#CA7CAE,53|54|55|56|57,,,,,25.7877,-80.2241
61,Calgary,CA,"Calgary is Canada's fastest growing city, with over 20,000 new inhabitants arriving each year. One of Canada's top tourist destinations, it's home to glittering sky rises, exploding downtown food and cultural scenes, and the Calgary Stampede, the world's largest rodeo. it's also the gateway to the incredible Rocky Mountains and many of small towns which reflect Alberta's diverse cultural roots. Calgary Travel Massive seeks to organize local meetups for Calgary-based travel & tourism companies, bloggers, startups and media to connect face to face. (This gorgeous photo is kindly shared by Neil Zeller)",104|105,Calgary.jpg,CAL,#91CD79,58|59|60,,https://www.facebook.com/CalgaryTravelMassive,,,51.05,-114.0667
62,Baltimore,US,"An hour from Washington D.C. and 90 minutes from Philadelphia, B-more as Baltimore is affectionately called by locals, is one of America's most populous cities. Culturally rich, Baltimore has no shortage of ethnic restaurants, historic attractions, and lively entertainment to attract visitors and satiate locals. Several pop culture movies and television shows such as Hairspray, The Wire, and Veeps were either based off of or filmed in Charm City. Baltimore Travel Massive aims to bring together passionate travel professionals in all areas of the industry to include: writers, travel startups, hotel execs, restaurant owners, tour operators, bloggers, PR and CVB reps, travel brands, local chefs, travel associations, and all other individuals with a stake in the travel and hospitality field.",106|107,,BLT,#0A7F03,61|62|63,,,,,39.2833,-76.6167
63,Bali,ID,"Described by many as one of the world's most magical destinations, Ubud, despite the advance of yoga centers, spas, villas, and luxury hotels, remains relatively unchanged. The town has taken a stand against the encroachment of tourism and has defended its cultural practices and artistic endeavors against the influx of outsiders.",108|109,Bali.jpg,BAL,#4D5383,64|65|66,,https://www.facebook.com/pages/Travel-Massive-Bali/1499128580361964,,,-8.65,115.2167
64,Amsterdam,NL,"The vibrant and tolerant city of Amsterdam, capital of the Netherlands, is quite simply one of the greatest small cities in the world. With all the advantages of a big city: culture, nightlife, international restaurants, good transport Ð you can cycle across Amsterdam in under 20 minutes, or travel around by boat using over 100KM of scenic canals. Home to over 174 different nationalities, Amsterdam is a true melting pot of cultures. Travel Massive is AmsterdamÕs local community of travel industry start-ups and professionals who are passionate about the travel industry and looking to connect with one another. We look forward to meeting you.",110|111,,AMS,#89AA07,67|68|69|70|71,,,,,52.3667,4.9
